,id,channel,twitter,title,url,date,text,languague
19,BFhxrYUBAT5urZGg58tC,{'ejercitoremanente': [13550]},no_data,Ventana de Overton: Hacia la normalización de la pedofilia,ejercitoremanente.com,2023-01-14T01:23:21.281405,"¿Acaso no hay numerosos estudios de supuestos científicos bien regados de dinero para defender las ideologías o tesis que permitan la normalización de ciertas conductas? Si ocurre con el sector farmacéutico como bien sabemos, ¿por qué no iba a ocurrir con estudios sociológicos, entre otros?

Por Javier Villamor

Mediaset va a lanzar una serie en la que una mujer de 42 años tiene relaciones sexuales con un chico de 15. Más allá de si se supone que es una crítica o no a la pederastia, el hecho es que servirá para iniciar un debate inexistente en la sociedad que dentro de unos años devendrá en legislación y, por lo tanto, en modificación del status quo actual.

Esto es lo que se conoce como la famosa ventana de Overton, que no es otra cosa que el proceso político para que algo impensable/imposible acabe convirtiéndose en un hecho. Ejemplos existen varios en los últimos años: desde la partición de España en 17 comunidades autónomas ahora impensables de revertir para muchos (la ventana es aplicable en ambos sentidos de la misma dirección) a nivel político, hasta la reciente ley trans que permite el abuso infantil con la hormonación de menores, pasando por el mal llamado matrimonio homosexual, el aborto, la eutanasia, etc.

Todas estas leyes, especialmente las relacionadas con la ética o estructuración social, se han aprobado tras una serie de pasos muy concretos llevados a la perfección por el entramado político-mediático. Primero, cuando algo es improbable, puedes publicar sondeos (dirigidos, obviamente) que sirvan para mostrar cuál el barómetro al respecto. Después, puedes iniciar debates mediáticos que se hagan eco de esos sondeos o bien producir material audiovisual cultural para normalizar ciertos hechos cuando en la vida real no existen. Esto llevará a un aumento de la discusión público y, cuando esta sea rentable políticamente, determinados partidos harán banderas de esas causas. Si resultan ser elegidos y formar gobierno, legislarán para modificar la realidad en la que, previamente, ese hecho era impensable.

El proceso de normalización social

El ejemplo perfecto son las leyes de género. La ley de violencia de género abrió el camino a la ideología de género general, ésta dio paso a la enseñanza en las escuelas, y ahora estamos debatiendo la transexualidad, la hormonación e, incluso, la amputación de miembros sanos por trastornos mentales hoy considerados hechos objetivos en vez de realidades subjetivas en las personas que sufren, entre otras cosas, disforia de género. Sobre el matrimonio homosexual ocurre algo parecido. Todo empezó simplemente con el reconocimiento de la unión civil. Hoy, se ve normal que el colectivo LGTBI –que no las personas de manera individual– eduquen a nuestros hijos sexualmente induciendo a tener relaciones sin importar el sexo y a prácticas sodomíticas. Es decir, hemos normalizado el abuso infantil como sociedad.

Una infancia que es el paso final para la perversión final de toda la sociedad en su conjunto con vistas a los años por venir. Primero. porque, digamos, el cupo de propaganda ya no daba para más entre personas adultas (todo lavado de cerebro tiene un límite). Segundo, porque manipulando la mente de los más pequeños de hoy se generan las legiones de adeptos del mañana. Hoy lo común es que a un joven se le enseñe que la biología no condiciona tu existencia, que la objetividad no existe como hecho contrastable a través de los sentidos y que lo importante es el deseo subjetivo, el impulso de los sentimientos. Tercero, porque esa exaltación del yo lleva a la atomización total de la sociedad en detrimento de una colectivización positiva que busque el bien común. Cuarto, porque a través de la sexualización temprana de la sociedad es más fácil acabar con el correcto desarrollo psicoafectivo de la persona y crear en ella una serie de pautas y comportamientos nocivos para sí misma y para los demás.

Hoy nadie niega que Occidente está hipersexualizado, y no para bien. La publicidad, producciones audiovisuales, los dibujos, la música, los videojuegos… todo está sexualizado. Es fácil entender que cuando algo se consume en exceso se acaba necesitando más y más para satisfacer las hormonas que el cerebro produce cada vez que se le da placer. Aún muchos no entienden este sencillo mecanismo biológico que nos hace ser infinitamente menos racionales de lo que pensamos. Todo en nuestro entorno está creado para extasiarnos sensorialmente. Y todo es todo. Los niños son los más vulnerables a estos estímulos.

De unos años a esta parte, se ha ido moviendo la ventana de Overton en términos sexuales. En cuanto a sexo se refiere, parece que no hay límites (esto, entre otras cosas, es uno de los elementos clave del desprecio de otras culturas a la nuestra). En esta pendiente resbaladiza a priori inofensiva, ya se ha puesto el punto de mira en los más pequeños. En lo audiovisual, las cantantes son y parecen cada vez más jóvenes, más niñas. Algunas apenas han tenido un éxito inmenso con 18 años. Cada vez se adora más lo juvenil, cada vez se necesita más juventud. Tanta que se llega a la infancia. Esto es algo normal en la progresión que estamos viviendo. Es algo lógico, de alguna manera.

Pedofilia: un desorden, no un crimen

A esta normalización no sólo colabora Irene Montero declarando que los niños tienen derecho a tener relaciones con quien quieran (love is love, love has no age, dicen algunos), sino que es un proceso que, como he explicado, viene de largo. En 2014, un diario estadounidense publicaba un artículo titulado Pedofilia: un desorden, no un crimen en lo que es un claro ejemplo de esa ventana de Overton. Esto, que hace años hubiera significado la muerte civil del autor, hoy es visto con buenos ojos o, simplemente, con resignación (que es otra fase en la conversión). En unas sociedades que creen que toda la sexualidad es buena, que las identidades sexuales son tantas como días tiene un año, la pedofilia podría ser considerada una orientación más dentro de unos años. A muchos todavía les suena imposible, pero de eso se trata. De volver lo imposible posible a través de los escándalos. Paso a paso. Poco a poco. Por si esto fuera poco, recientemente la polémica a este respecto saltó en Chile por unas tesis que defendían la pederastia. Si se pensaban ustedes que la academia estaba fuera de este proceso, se equivocaban. ¿Acaso no hay numerosos estudios de supuestos científicos bien regados de dinero para defender las ideologías o tesis que permitan la normalización de ciertas conductas? Si ocurre con el sector farmacéutico como bien sabemos, ¿por qué no iba a ocurrir con estudios sociológicos, entre otros?

Ahora, toca al turno a Mediaset en lo que significa un paso enorme para llegar con esta polémica al gran público. No deja de llamar la atención que la relación sea entre mujer adulta y hombre adolescente. ¿Será porque está mejor vista? ¿Se imaginan si fuera al revés? ¿Cómo se pondrían ciertos sectores feministas? ¿O no dirían nada porque love is love y la mujer es libre de elegir si quiere acostarse con un hombre mucho mayor que ella?

Ésta no es la única trampa. Hay un movimiento que, aprovechando la buena aceptación de la ideología LGTB, busca esta normalización de la pedofilia/pederastia. Es el conocido movimiento transage (transedad). Es decir, personas que no se sienten con la edad que objetivamente tienen y reclaman el derecho a tener relaciones sexuales con personas de edad muy inferior a la suya. Tan inferior que es ilegal porque es pederastia. Y he aquí la trampa argumentativa: si aceptamos que una persona puede sentirse lo que sea y ser lo que siente, ¿cómo vamos a negar a alguien que se sienta de una edad que no tiene? ¿Quién le dirá a un hombre trans que además de no ser mujer puede no tener 50 años y acostarse con un chico de 12, 10 u ocho siempre y cuando exista el sacrosanto consentimiento? Y con esto del consentimiento del «sólo sí es sí» es fácil también entender por dónde van los tiros. Se empieza a ver el bosque detrás del árbol. O quizás no, pero el bosque existe queramos o no verlo. Y no es un bosque precisamente amigable para los más indefensos.

Todo empieza como una locura o algo «sacado de contexto» como calificó la Conferencia Episcopal a las declaraciones de Montero.

Gaceta

Toda clase de pecado será legislado, y la oscuridad de la bestia cubrirá al mundo Mensaje del Libro de la Verdad 🏹 15 de abril de 2013 Los enemigos de Dios ahora aumentan en gran número, en cada nación, para condenar las Leyes de Dios. Habrá muchas leyes nuevas introducidas en cada país y en cada iglesia. La mayoría de las leyes estarán en contra de las Enseñanzas establecidas en la Santa Biblia. Toda clase de pecado será legislado, y la oscuridad de la bestia cubrirá al mundo. Aquellos que se opongan a estas leyes serán despedidos como maniáticos y demonizados. Sus voces serán ahogadas por aquellos que abrazan el laicismo, como si se tratara de una auténtica religión. Ellos usarán todo argumento intelectual para hacer cumplir sus leyes malvadas y engañarán a muchos, porque utilizarán los derechos humanos como herramienta para controlar a los demás. Muchos no serán lo suficientemente fuertes para luchar contra el aborto, la eutanasia y el matrimonio del mismo sexo. Entonces, justamente cuando las leyes sean creadas, la Iglesia Católica anunciará la reforma para reconocer todos los derechos humanos y todas las religiones. Esto irá seguido de una terrible división entre aquellos que están bendecidos con el don de la percepción, dado a ellos por el Espíritu Santo, y aquellos cuyo único deseo es el amor a sí mismos, y que rechazan a Dios. Ellos ven a Dios, y a Mis Enseñanzas, como un obstáculo para vivir lo que ellos creen que es un libre estilo de vida. La poderosa organización élite mundial, que está infiltrada en todos los rincones del mundo, planeará nuevas leyes eclesiásticas, y conspirará para derrocar a los líderes, mientras que al mismo tiempo, ideará guerras, lo que traerá la destrucción. Tan orgullosos son ellos, y tal es la extensión de su lealtad a la adulación satánica, que creen que son indispensables. Cómo tendrán que sufrir por sus actos malvados. Así como ellos creen que pueden controlar a otros e imponer sus tortuosos planes en otros, así ellos serán derribados por la Mano de Mi Padre. Se les dará solo el tiempo suficiente para volver su espalda. Después, ellos se volverán unos contra otros y se destruirán unos a otros. Tal será el nivel de su sufrimiento que aún al final, no será suficiente hacerles ver lo que les espera si continuaran estando atados al maligno. Para mucha gente, que no es de Dios, notarán un poco de estos eventos en un principio. Será sólo cuando su libertad sea restringida, que se rebelarán abiertamente contra las injusticias dentro de sus naciones. Ellos entonces se darán cuenta del horror que se habrá estado creando porque la Luz de Dios se habrá extinguido. En su lugar habrá oscuridad, vacío, hambre y carencia de amor. Solo entonces el hombre clamará por la Misericordia de Dios. Yo estaré allí, esperando, para darles consuelo y salvar sus pobres aterradas almas. Vuestro Jesús Leer más: https://www.elgranaviso-mensajes.com/news/a15-abr-2013-muchos-no-seran-lo-suficientemente-fuertes-para-luchar-contra-el-aborto-la-eutanasia-y-el-matrimonio-del-mismo-sexo/",es
20,B1hxrYUBAT5urZGg_cve,{'ejercitoremanente': [13546]},no_data,Coronilla de la Divina Misericordia y Promesas que contiene,ejercitoremanente.com,2023-01-14T01:23:27.069124,"“Me queman las llamas de la Misericordia, deseo derramarlas sobre las almas, y las almas no quieren creer en mi bondad. Oh, qué dolor me dan cuando no quieren aceptarlas (…) Dile a la humanidad doliente que se abrace a mi Corazón misericordioso y Yo la llenaré de paz”.

A continuación, podrán leer las promesas dictadas por Jesús a Santa Faustina Kowalska:

“La humanidad no encontrará la paz hasta que no se dirija con confianza a mi Misericordia”.



«De todas Mis llagas, como de arroyos, fluye la misericordia para las almas, pero la herida de Mi Corazón es la Fuente de la Misericordia sin límites, de esta fuente brotan todas las gracias para las almas».



“El alma que confíe en mi Misericordia no perecerá, ya que todos sus asuntos son míos. El alma más feliz es la que confía en mi Misericordia, pues Yo mismo la cuido”.



«Proclama que ningún alma que ha invocado Mi misericordia ha quedado decepcionada ni ha sentido confusión».

«Hija Mía, escribe que cuanto más grande es la miseria de un alma tanto más grande es el derecho que tiene a Mi misericordia e invita a todas las almas a confiar en el inconcebible abismo de Mi misericordia, porque deseo salvarlas a todas. En la cruz, la Fuente de Mi Misericordia fue abierta de par en par por la lanza para todas las almas, no he excluido a ninguna».



«Que los más grandes pecadores pongan su confianza en Mi misericordia. Ellos más que nadie tienen derecho a confiar en el abismo de Mi misericordia. Hija Mía, escribe sobre Mi misericordia para las almas afligidas. Me deleitan las almas que recurren a Mi misericordia. A estas almas les concedo gracias por encima de lo que piden. No puedo castigar aún al pecador más grande si él suplica Mi compasión, sino que lo justifico en Mi insondable e impenetrable misericordia. Escribe: Antes de venir como juez justo abro de par en par la puerta de Mi misericordia. Quien no quiere pasar por la puerta de Mi misericordia, tiene que pasar por la puerta de Mi justicia…»

«Prometo que el alma que venere esta imagen no perecerá. También prometo ya aquí en la tierra la victoria sobre el enemigo y sobretodo a la hora de la muerte, Yo mismo la defenderé como a mi propia gloria… Ofrezco a los hombres el vaso con el que han de venir a recoger las gracias a la fuente de la Misericordia».

«A las almas que difunden el culto de mi Misericordia, las protejo a lo largo de su vida como una madre cariñosa protege a su niño todavía lactante. A la hora de su muerte, no seré para ellas su juez sino su Salvador misericordioso. En aquella última hora no hay para el alma más que una sola protección: MI MISERICORDIA»…

«Yo preservaré a las ciudades y casas en las cuales se encontrase esta imagen».



«Yo también protegeré a aquellas personas que veneren esta Imagen y tengan confianza en mi Misericordia».

HORA DE LA DIVINA MISERICORDIA: LAS TRES DE LA TARDE

Oración para recibir vigor y valentía a la hora de dar a conocer los Mensajes

Lléname ahora, Oh Señor, con el Don del Espíritu Santo para llevar Tu Santísima Palabra a los pecadores que debo ayudar a salvar en Tu nombre.

Ayúdame a cubrirlos, a través de mis oraciones, con Tu Preciosa Sangre, para que así ellos puedan ser atraídos a Tu Sagrado Corazón.

Dame el Don del Espíritu Santo para que así estas pobres almas puedan deleitarse en Tu Nuevo Paraíso.

Amén

Digan esta oración todos los días, después de recitar Mi Divina Misericordia y ustedes, por su lealtad a Mí, ayudarán a salvar a Mis hijos.

La oración de las tres dictada por Jesús a Santa Faustina Kowalska es la siguiente:

Expiraste, Jesús, pero Tu muerte hizo brotar un manantial de vida para las almas y el océano de Tu misericordia inundó todo el mundo. Oh, Fuente de Vida, insondable misericordia divina, anega el mundo entero derramando sobre nosotros hasta Tu última gota.

Oh, Sangre y Agua que brotaste del Corazón de Jesús, manantial de misericordia para nosotros, en Ti confío.

El Señor le dijo a Santa Faustina Kowalska lo siguiente:

Un látigo poderoso para usar contra las próximas amenazas (tormentas, terremotos,erupciones volcánicas, tsunamis, etc.)

Dos casos aparecen en el Diario de Santa María Faustina que envuelven tormentas, #1731 y# 1791, y en ellos ella usa la Coronilla de la Divina Misericordia como un látigo poderoso:

“Hoy me despertó una gran tormenta, el viento estaba enfurecido y llovía como si hubiera un huracán, a cada rato caían rayos. Me puse a rogar que la tempestad no causara ningún daño; de repente oí estas palabras: Reza la coronilla que te he enseñado y la tempestad cesará. Enseguida he comenzado a rezar la coronilla y ni siquiera la he terminado cuando el temporal ha cesado y oí estas palabras: A través de ella obtendrás todo, si lo que pides está de acuerdo con mi voluntad.” (1731)

“Cuando se acercaba una gran tormenta me puse a rezar la coronilla. De repente oí la voz de un ángel: no puedo acercarme con la tempestad, porque el resplandor que sale de su boca me rechaza a mí y a la tormenta. Se quejaba el ángel con Dios. De súbito conocí lo mucho que habría de devastar con esa tempestad, pero conocí también que esa oración era agradable a Dios y lo potente que es la coronilla.” (1791)

Historia y más promesas:

En 1935, Santa Faustina recibió la visión de un ángel enviado por Dios para amenazar cierta ciudad. Ella comenzó a orar por misericordia, pero sus oraciones no tuvieron poder. De repente, vio a la Santísima Trinidad y sintió el poder de la gracia de Jesús en ella. Al mismo tiempo, se encontró a ella misma abogando a Dios por misericordia con palabras que escuchó interiormente.

“Padre Eterno, Te ofrezco el Cuerpo y la Sangre, el Alma y la Divinidad de Tu Amadísimo Hijo, nuestro Señor Jesucristo, como propiciación de nuestros pecados y los del mundo entero; por Su dolorosa pasión, ten misericordia de nosotros y del mundo entero.” (Diario, 476)

“Mientras ella continuó diciendo esta oración inspirada, el ángel se quedó sin ayuda y no pudo llevar a cabo el castigo merecido” (ver Diario, 474, 475)



Al día siguiente, mientras entraba a la capilla, escuchó de nuevo esta voz interior, instruyéndola cómo recitar la oración que Nuestro Señor más tarde llamaría “la Coronilla”. Desde ese momento, ella recitó esta forma de oración casi constantemente, ofreciéndola especialmente por los moribundos.

En posteriores revelaciones, el Señor hizo claro que la Coronilla no era sólo para ella, sino para todo el mundo. Él también atribuyó promesas extraordinarias a su recitación.

“Anima a las almas a rezar la Coronilla que te he dado” (Diario, 1541)

“Quienquiera que la rece recibirá gran misericordia a la hora de la muerte” (Diario, 687)

“Cuando recen esta coronilla junto a los moribundos, Me pondré ante el Padre y el alma agonizante no como Juez justo sino como el Salvador Misericordioso.” (Diario, 1541)

“Los sacerdotes se la recomendarán a los pecadores como la última tabla de salvación. Hasta el pecador mas empedernido, si reza esta coronilla una sola vez, recibirá la gracia de Mi misericordia infinita.” (Diario, 687)

“A través de ella obtendrás todo, si lo que pides está de acuerdo con Mi voluntad” (Diario, 1731)

“Deseo conceder gracias inimaginables a las almas que confían en Mi misericordia” (Diario 687)





En relación a los últimos tiempos»

«Prepararás al mundo para Mi última venida.» (Diario 429)

«Habla al mundo de mi Misericordia… Es señal de los últimos tiempos. Después de ella vendrá el día de la justicia. Todavía queda tiempo para que recurran, pues, a la Fuente de Mi Misericordia.» (Diario 848)

«Habla a las almas de esta gran misericordia Mía, porque está cercano el día de Mi justicia.» (Diario 965)

«Estoy prolongándoles el tiempo de la misericordia, pero ay de ellos si no reconocen este tiempo de Mi visita.» (Diario 1160)

Antes del Día de la justicia envío el día de la misericordia». (Diario 1588)

«Quien no quiera pasar por la puerta de Mi misericordia, tiene que pasar por la puerta de Mi justicia». (Diario 1146)

Además de estas palabras de Nuestro Señor, la hermana Faustina nos da las palabras de la Madre de Misericordia, la Santísima Virgen María.

«Tú debes hablar al mundo de Su gran misericordia y preparar al mundo para Su segunda venida. Él vendrá, no como un Salvador Misericordioso, sino como un Juez Justo. Oh qué terrible es ese día. Establecido está ya el día de la justicia, el día de la ira divina. Los ángeles tiemblan ante este día. Habla a las almas de esa gran misericordia, mientras sea aún el tiempo para conceder la misericordia.» (Diario 635)

Coronilla de la Divina Misericordia Latín Audio

CORONILLA DE LA DIVINA MISERICORDIA ESPAÑOL / LATÍN

Diario de Santa Faustina PDF

http://webcatolicodejavier.org/promesasDivinaMisericordia.html

Reciten la Coronilla de Mi Divina Misericordia todos los días Mensaje del Libro de la Verdad 🏹 13 de junio de 2011 La oración está aumentando ahora a un ritmo más fuerte, debido al Don del Espíritu Santo que ha penetrado las almas de todos Mis seguidores por todo el mundo. Sus oídos están ahora alerta a Mi Santísima Palabra. Recen por todos Mis pobres atormentados hijos, que están sufriendo gran dificultad en el mundo como resultado del horror de los actos de los que son víctimas. Todo debido a los pecados de la humanidad. Déjenme recordarles a todos Mis hijos de todas partes que reciten la Coronilla de Mi Divina Misericordia todos los días. Recen también, e incluyo a todas las creencias cristianas, el Santo Rosario a Mi amada Madre, ya que esta oración poderosa debilitará el poder de Satanás sobre Mis hijos. Todo lo que pido, es que todos ustedes que están en dolor con pruebas y preocupaciones, que me entreguen ahora todas estas inquietudes y me permitan encargarme de ellas. Confíen en Mí y su carga será aligerada. Déjenme guiarlos a un estado más pacífico. Relájense hijos Míos y permitan que Mi Paz inunde sus delicadas y hambrientas almas. La oscuridad que sienten proviene del miedo. El miedo proviene de la falta de confianza. Cuando pierden la confianza en Mí, Satanás planta dudas en sus mentes. Nunca subestimen lo que él hace cuando constantemente juega juegos para volverlos en contra de su prójimo. Este engaño es siempre primeramente dirigido a Mis más devotos seguidores. Él los odia si me aman. Él nunca descansará hasta que los inquiete. Él se ríe cuando ustedes se tambalean. No le den este poder, porque cuando lo hacen su fe en Mí se debilita. La oración a San Miguel y la recitación del Santísimo Rosario son sus armas más poderosas contra Satanás. Vayan ahora con más seguridad y entréguenme sus problemas y preocupaciones porque estoy aquí esperándolos en todo momento para llevarlos a la Luz. Los amo a todos, hijos. Confíen más en Mí Su amoroso Salvador, Jesucristo Leer más: http://m.elgranaviso-mensajes.com/news/jun-13-2011-entreguenme-sus-problemas-y-les-aliviare-la-carga/",es
