,id,channel,twitter,title,url,date,text,languague
109,l1hwsIUBAT5urZGgpsvM,{'periodistasporlaverdad': [2170]},no_data,El orden mundial ya cambió en 2022,periodistasporlaverdad.com,2023-01-14T15:20:50.891559,"por Thierry Meyssan

Es una constante de la Historia: los cambios son raros, pero repentinos. Aquellos que soportan la peor parte son generalmente los últimos en verlos venir. Los perciben demasiado tarde. Contrariamente a la imagen estática que prevalece en Occidente, las relaciones internacionales han dado un vuelco en 2022, principalmente en detrimento de Estados Unidos, Reino Unido y Francia, a menudo en beneficio de China y Rusia. Con los ojos clavados en Ucrania, los occidentales no perciben la redistribución de las cartas.

Es raro que las relaciones internacionales se vean sacudidas como lo fueron en 2022. Y no ha terminado. El proceso que ha comenzado no se detendrá, incluso si los acontecimientos lo trastornan y posiblemente lo interrumpan por algunos años. El dominio de Occidente, tanto de Estados Unidos como de las antiguas potencias coloniales de Europa (principalmente Reino Unido, Francia y España) y Asia (Japón), está llegando a su fin. Ya nadie obedece a un líder, incluidos los estados que siguen siendo vasallos de Washington. Ahora todos están comenzando a pensar por sí mismos. Todavía no estamos en el mundo multipolar que Rusia y China están tratando de crear, pero lo estamos viendo construir.

Todo comenzó con la operación militar rusa para hacer cumplir la Resolución 2202 del Consejo de Seguridad y proteger a toda la población ucraniana de su gobierno “nacionalista integral”. Por supuesto, este evento no es para nada lo que se percibe en Estados Unidos, la Unión Europea, Australia y Japón. Occidente está convencido de que Rusia ha invadido Ucrania para cambiar sus fronteras por la fuerza. Sin embargo, esto no es lo que anunció el presidente Vladimir Putin, ni lo que hizo el ejército ruso, ni cómo se desarrollaron los acontecimientos.

Dejemos de lado la cuestión de quién tiene razón y quién no. Todo depende de si uno es consciente de la guerra civil que ha estado desgarrando a Ucrania desde la deposición de su presidente democráticamente electo, Viktor Yanukovych, en 2014. Los occidentales que olvidan las 20.000 muertes de esta guerra no pueden considerar que los rusos querían detener esto. masacre. Ignorando los acuerdos de Minsk, de los que Alemania y Francia fueron garantes junto a Rusia, no pueden considerar que Rusia haya puesto en práctica la “responsabilidad de proteger” que proclamó Naciones Unidas en 2005.

Sin embargo, la ex canciller alemana Angela Merkel y el ex presidente francés François Hollande, ambos han declarado públicamente que firmaron los Acuerdos de Minsk, no para poner fin a la guerra civil, sino por el contrario para ganar tiempo y armar a Ucrania. Ambas figuras se felicitan por haber incriminado a Rusia mientras la acusan de ser la única responsable de la guerra actual. No es de extrañar que estos dos exgobernantes se enorgullezcan de su duplicidad frente a sus opiniones públicas, sin embargo sus palabras escuchadas en otras partes del mundo suenan diferente. Para la mayoría de la humanidad, Occidente está mostrando sus verdaderos colores: todavía está tratando de dividir al resto del mundo y atrapar a aquellos que quieren ser independientes; habla de paz, pero fomenta guerras.

Es erróneo imaginar que los más fuertes siempre quieren imponer su voluntad a los demás. Esta actitud occidental rara vez es compartida por otros humanos. La cooperación ha demostrado ser mucho más eficaz que la explotación y las revoluciones que provoca. Este es el mensaje que los chinos han tratado de propagar al hablar de relaciones de “ganar-ganar”. No se trataba de relaciones comerciales justas, sino de la forma en que gobernaban los emperadores chinos: cuando un emperador emitía un decreto, tenía que asegurarse de que fuera seguido por los gobernadores de cada provincia, incluidos aquellos que no se vieron afectados por la decisión. Les mostró que no los había olvidado dándoles un regalo a cada uno.

En diez meses, el resto del mundo, es decir, la inmensa mayoría, ha abierto los ojos. Si, el 13 de octubre, 143 estados siguieron la narrativa occidental y condenaron la “agresión” rusa, ya no serían mayoría en la Asamblea General de la ONU para votar de esta manera hoy. Prueba de ello es la votación, el 30 de diciembre, de una resolución que pide al tribunal interno de la ONU, la Corte Internacional de Justicia, que declare la ocupación de los Territorios Palestinos por parte de Israel como “ocupación”. La Asamblea General ya no se resigna al desorden occidental del mundo.

11 estados africanos, anteriormente en la órbita de Francia, recurrieron al ejército ruso o a una empresa militar privada rusa para garantizar su seguridad. Ya no creen en la sinceridad de Francia y Estados Unidos. Aún otros son conscientes de que la protección occidental contra los yihadistas va de la mano con el apoyo encubierto occidental a los yihadistas. Están públicamente preocupados por la transferencia masiva de armas con destino a Ucrania a los yihadistas del Sahel oa Boko Haram, hasta el punto de que el Departamento de Defensa de EE.UU. ha designado una misión de seguimiento para verificar qué ocurre con las armas con destino a Ucrania , como una forma de enterrar el problema y evitar que el Congreso se inmiscuya en estos oscuros esquemas.

En Medio Oriente, Turquía, miembro de la OTAN, está jugando un juego sutil entre su aliado estadounidense y su socio ruso. Ankara se dio cuenta hace mucho tiempo de que nunca se uniría a la Unión Europea y, más recientemente, que ya no se esperaba que restaurara su imperio sobre los árabes. Por lo tanto, se está dirigiendo a los estados europeos (como los búlgaros, los húngaros y los kosovares) y los estados asiáticos (como Azerbaiyán, Turkmenistán, Uzbekistán, Kazajstán y Kirguistán) con una cultura turca (y no una lengua turca como los uigures chinos). Como resultado, Ankara se reconcilia con Damasco y se prepara para dejar Occidente por Oriente.

La llegada de China al Golfo en la cumbre de Riad ha cambiado las tornas en esa parte del mundo. Los estados árabes vieron que Beijing era razonable, que los estaba ayudando a hacer las paces con sus vecinos persas. Sin embargo, Irán es un antiguo aliado de China, pero China lo defiende sin dejar que se salga con la suya con sus excesos. Han medido la diferencia con Occidente que, por el contrario, no ha parado desde 1979 de dividirlos y oponerse a ellos.

India e Irán están trabajando duro con Rusia para construir un corredor de transporte que les permita comerciar a pesar de la guerra económica occidental (presentada en Occidente como “sanciones”, aunque estas son ilegales según el derecho internacional). Mumbai ya está conectada con el sur de Rusia y pronto con Moscú y San Petersburgo. Esto hace que Rusia y China sean complementarias. Beijing está construyendo carreteras en Eurasia de este a oeste, Moscú a lo largo de las longitudes.

China, para quien esta guerra es una catástrofe que trastoca sus planes de construir las Rutas de la Seda, nunca se ha adherido a la narrativa occidental. Es una antigua víctima de Rusia, que en el siglo XIX participó en la ocupación de Tianjin y Wuhan (Hankou), pero sabe que Occidente hará todo lo posible para explotarlos a ambos. Recuerda su ocupación pasada para ser consciente de que su destino está ligado al de Rusia. No entiende mucho de los asuntos ucranianos, pero sabe que su visión de la organización de las relaciones internacionales solo puede lograrse si Rusia triunfa. No tiene ningún deseo de luchar junto a Rusia, pero intervendrá si Rusia se ve amenazada.

Esta reorientación del mundo es muy visible en las instituciones gubernamentales. Occidente humilló a Rusia en el Consejo de Europa hasta que Moscú se fue. Para su sorpresa, Rusia no se detuvo ahí. Dejó uno a uno todos los acuerdos concluidos en el Consejo de Europa, en todo tipo de campos, desde el deportivo hasta el cultural. Occidente se da cuenta de repente de que se ha privado de un socio generoso y culto.

Debe continuar en todas las demás organizaciones intergubernamentales, comenzando por las Naciones Unidas. Esta es una vieja historia en las relaciones entre Rusia occidental y que se remonta a la exclusión de Moscú de la Liga de las Naciones en 1939. En ese momento, los soviéticos, preocupados por un posible ataque nazi a Leningrado (San Petersburgo), pidieron a Finlandia que alquilara el puerto de Hanko, pero las negociaciones se prolongaron e invadieron Finlandia, no para anexionarlo, sino para colocar su armada en Hanko. Este precedente se enseña hoy como ejemplo del imperialismo ruso, aunque el propio presidente finlandés, Urho Kekkonen, reconoció que la actitud soviética era “comprensible”.

Volvamos a las Naciones Unidas. Excluir a Rusia sólo podría ser posible después de que la Asamblea General aprobara una reforma de la Carta. Esto fue posible en octubre, pero no hoy. Este proyecto va acompañado de una reinterpretación de la historia y naturaleza de la ONU.

Se afirma que la pertenencia a la Organización prohíbe la guerra. Esto no tiene sentido. La pertenencia a la ONU obliga a “mantener la paz y la seguridad internacionales”, pero siendo los hombres lo que son, autoriza el uso de la fuerza bajo ciertas condiciones. A veces, esta autorización se convierte incluso en una obligación bajo la “responsabilidad de proteger”. Esto es exactamente lo que Rusia está haciendo por la gente de Donbass y Novorussia. Tenga en cuenta que Moscú no está ciega y ha retrocedido desde la margen derecha (parte norte) de la ciudad de Kershon. El Estado Mayor ruso se retiró tras una frontera natural, el río Dniéper, por considerar imposible defender la otra parte de la ciudad de los ejércitos occidentales, a pesar de que la población de toda la ciudad había pedido en referéndum unirse a la Federación Rusa.

Sobre todo, cuestionar la dirección del Consejo de Seguridad oscurece el funcionamiento de la ONU. Cuando se fundó la Organización, fue para reconocer la igualdad de cada Estado en la Asamblea General y para dar a las grandes potencias de la época la capacidad de prevenir conflictos dentro del Consejo de Seguridad. El Consejo de Seguridad no es un lugar de democracia, sino de consenso: ninguna decisión puede tomarse sin el acuerdo de cada uno de sus cinco miembros permanentes. La gente finge estar sorprendida de que no pueda condenar a Rusia, pero ¿le sorprende que Estados Unidos, el Reino Unido y, a veces, Francia no hayan sido condenados por sus guerras ilegales en Kosovo, Afganistán, Irak y Libia? Sin derecho de veto, la ONU se convertirá en una asamblea absolutamente ineficaz. Sin embargo, esta idea está ganando terreno en Occidente.

Además, sería absurdo pensar que China, la primera potencia comercial mundial, se quedaría en una ONU de la que Rusia, la primera potencia militar mundial, habría quedado excluida. Pekín no jugará el papel de garante en una operación contra su aliado, ya que está convencido de que su muerte será el preludio de la suya. Por eso los rusos y los chinos están preparando otras instituciones que sólo manifestarán si la ONU se desnaturaliza, si se transforma en una asamblea monocromática y pierde así su capacidad de prevención de conflictos.

Percibimos que la única salida posible es que Occidente acepte que es lo que es. Pero, por el momento, no son capaces de hacerlo. Distorsionan la realidad con la esperanza de mantener sus siglos de hegemonía. Este juego ha terminado, tanto porque están cansados ​​como porque el resto del mundo ha cambiado.

Thierry Meyssan

Articulo republicado bajo licencia Creative Commons ( licencia CC BY-NC-ND).: “The world order already changed in 2022”, by Thierry Meyssan, Translation Roger Lagassé, Voltaire Network, 10 January 2023, www.voltairenet.org/article218636.html",es
110,mFhwsIUBAT5urZGgq8v6,{'elinvestigador_org': [13177]},no_data,"El cardiólogo Aseem Malhotra presenta su estudio, revisado por pares, sobre la eficacia y la seguridad de las vacunas ARNm: exige la retirada inmediata de las vacunas Covid-19",diario16.com,2023-01-14T15:20:52.217048,"- Publicidad-

El reconocido cardiólogo británico Aseem Marlhotra ha dado a conocer hoy la publicación de su estudio sobre la eficacia y seguridad de las vacunas de ARN mensajero en The Journal of Insulin Resistance.

En la entrevista que le ha realizado James Freeman, que puede consultarse aquí, el autor del estudio señala expresamente que las vacunas contra el Covid-19 deben ser retiradas inmediatamente, ante las evidencias que, según este cardiólogo, se muestran en sus investigaciones.

En la entrevista, el cardiólogo comienza lanzando un mensaje contundente: «Lo que el público en general necesita entender es que el sistema actual, está empujando a gente buena a hacer cosas malas. Y la raíz del problema son las grandes y poderosas corporaciones que tienen mucha influencia en los gobiernos, en el sistema de salud, en los medios de comunicación y su principal responsabilidad es sacar beneficios para sus socios, no darles a ustedes los mejores tratamientos».

«Cuando usted comprenda esto, entonces, podremos comenzar a hacer algo para transformar el sistema.»

Señala que la manera de operar de estos poderes es «como psicópatas». «Son entidades psicópatas».

La conclusión final es que «tenemos entidades psicópatas influyendo en la salud pública y esto se tiene que parar, y se tiene que parar ya».

Este experto en cardiología explica que el pasado año, en el mes de julio su padre (un prestigioso médico del servicio público de Salud de Reino Unido) falleció y esta situación le hizo alarmarse, puesto que se trataba de un hombre sano, de 73 años, sin causa aparente para que pudiera fallecer de la manera en que falleció. Lo que encontraron en la autopsia fue lo que hizo a este investigador poner el foco en el caso: trombos en las arterias que no tenían sentido, según el cardiólogo.

Malhotra está convencido de que su padre murió a causa de la vacuna contra el Covid-19. Tanto él como su padre creían firmemente en la vacuna y se la pusieron. Por lo que en un primer momento, no tenían rechazo hacia ellas. No es antivacunas. No se ha opuesto nunca a las vacunas. «Fui uno de los primeros en ponérmela». «Pero esta vacuna en particular ha sido hecha de una manera especial (…)» Y lo que le hizo comenzar a sospechar fueron los mandatos por parte del Gobierno, que hacían que no quedase claro exactamente qué estaba sucediendo.

Poco después, comenzaron a aparecer datos que señalaban el aumento del riesgo de ataques al corazón tras las vacunas de Covid-19, por un mecanismo de inflamación alrededor de las arterias coronarias. Contactó entonces con un denunciante, un investigador de una Universidad, que también es cardiólogo, que había detectado casos similares en su departamento. Los investigadores de su departamento de la Universidad habían decidido no denunciar nada públicamente porque tenían miedo de perder la financiación que provenía de la industria farmacéutica.

Explica el cardiólogo Malhotra que fue entonces cuando inició una investigación en los datos de Reino Unido. Y detectó el incremento de 14.000 ataques al corazón más fuera del hospital en 2021 en comparación con 2020.

En su propio entorno, una docena de personas, han sufrido ataques cardiacos en el periodo de las dos semanas posteriores a las vacunas.

«Para mí, la evidencia es muy muy clara», dice el Dr. Aseem Malhotra.

«Cuando miras a los ensayos originales de Pfizer, publicados en el Journal of Medicine», dice el doctor, «ves que hay claro vínculo entre esta particular vacuna y el aumento del riesgo de afección cardiaca».

«Ahora sabemos que causa miocarditis, probablemente en uno de cada 2.700 personas, que es la inflamación del músculo del corazón; Sabemos que hay una señal para paros cardiacos. Los datos de Israel recientemente publicados en Nature muestran que en las edades entre 16 y 39 años ha habido un 25% de aumento en ataques de corazón o paros cardiacos, no vinculados al Covid, sino absolutamente vinculados a las vacunas de ARNm».

«Si miras los datos en su conjunto, necesitamos análisis más contundentes, en los que la gente pueda entender cuál es beneficio potencial de la vacuna para ellos, frente a los riesgos. Pero, sobre todo, de los datos que he analizado y están documentados, es fundamental hacer una llamada para la completa suspensión de esta vacuna«. En este sentido, el experto hace un llamamiento para poder debatir de manera honesta y profunda sobre los beneficios y los riesgos reales de estas inyecciones.

El experto señala que para él, es mucho más importante se honesto, buscar la verdad y garantizar la seguridad de sus pacientes. Y señala que las corporaciones no han permitido que el debate necesario se haya producido por su poder sobre los gobiernos, los políticos y los medios de comunicación.

El contenido del estudio puede consultarse directamente pulsando aquí, para la primera parte del estudio y aquí para la segunda parte del estudio.",es
111,mVhwsIUBAT5urZGgssvR,{'elinvestigador_org': [13177]},no_data,[Documental] Seguras y efectivas. Una segunda opinión.,elinvestigador.org,2023-01-14T15:20:53.968474,"El documental independiente producido en Reino Unido (UK) publicado en Octubre de 2022 «Seguras y eficaces: Una segunda opinión» arroja luz sobre las lesiones y los fallecimientos causados por las vacunas experimentales de Covid-19.

Muestra cómo se ha permitido desde las instituciones públicas y políticas que ocurra todo esto.

Se analizan los ensayos farmacéuticos realizados, el papel de MHRA en la regulación de estos productos experimentales (con solo licencia de uso de emergencia).

Incluso se muestra cómo el comité de expertos del gobierno de Reino Unido (SAGE) incluye «científicos sobre el comportamiento humano» para influir en las políticas adoptadas.

Y se analiza el papel de los medios de comunicación y de las grandes empresas tecnológicas en la supresión del debate libre y abierto sobre la seguridad, eficacia, y los daños y muertes causados por las inoculaciones de las vacunas experimentales Covid.

El documental inicialmente no fue censurado por Youtube (algo raro), pero en cuanto llegó a más de 1 millón de visualizaciones, lo han censurado, por eso desde elinvestigador.org te lo ofrecemos en plataformas resistentes a la censura y con subtítulos en español (cortesía de counterpropaganda2020).

Producido en colaboración con Oracle Films y Mark Sharman; antiguo ejecutivo de ITV y BSkyB y News Uncut.

SEGURAS Y EFECTIVAS:

UNA SEGUNDA OPINIÓN

DOCUMENTAL DE REINO UNIDO CON SUBS EN ESPAÑOL

55 minutos. Producido por Oracle Films. Subtitulado al español

Enlaces para ver el video en plataformas resistentes a la censura.

→ Ver video en Rumble

→ Ver video en Odysee (en alta calidad)

—————————

→ Descargar video desde Odysee (gratis, directamente, sin registrarse en nada)

Web de Oracle Films con subtítulos en múltiples idiomas, incluido español: https://www.oraclefilms.com/safeandeffective

Versión original en ingles: English original Versión

→ Ver video en Odysee (en calidad máxima)

Enlaces para investigar más:

Web oficial de los productores Oracle Films: https://www.oraclefilms.com/safeandeffective

Canal de Odysee the Oracle Films: https://odysee.com/@OracleFilms:1

Canal de Odysee del subtitulador CounterPropaganda2020: https://odysee.com/@counterpropaganda2020:a

[SECCION SOBRE VACUNAS DE ELINVESTIGADOR.OR] Información sobre Vacunas que difícilmente encontrarás en Televisión.

Si conoces de videos y otros enlaces de interés que podríamos incluir, nos encantará incorporarlos. Si quieres participar en mejorar este artículo u otros. Contáctanos.

Copyright © El Investigador.org autoriza la reproducción de sus publicaciones a condición de que se cite la autoría de forma clara al inicio (con enlace al artículo original), de que la información no sea modificada, ni se utilice con fines comerciales (licencia CC BY-NC-ND).

Disclaimer: Este artículo no ha sido pagado o promocionado por ninguna institución, asociación, empresa, gobierno, partido político o grupo religioso. Lo compartimos porque creemos que puede ser útil y puede ayudarte a que formes tu propio criterio sobre el tema. Aquí puedes saber más sobre nuestros principios. Y aquí tienes el aviso legal y descargo de responsabilidad.",es
112,lFhwsIUBAT5urZGgjMtV,{'saludprohibidaandreaskalcker': [3447]},no_data,ALK Foundation,www.alk.foundation,2023-01-14T15:20:44.116557,"International Foundation Andreas Ludwig Kalcker

After more than 15 years of research we have been able to create the international Andreas Ludwig Kalcker Foundation A.C. legally registered and authorized donorship, to continue the work of biophysical research carried out by Dr. h.c. Andreas Kalcker, which has saved hundreds of thousands of lives, as well as offering hope to those who have been given a diagnosis of ""Incurable"".

It is important for us to follow electro-molecular medicine research in order to develop innovative therapies, and to teach physicians and healthcare professionals new avenues of therapeutic approach.

We now have inagurated our research center with more than 1500² meters at the service of the foundation, which also offers training classrooms, personal attention with innovative therapy areas for our members.





Learn more",en
113,llhwsIUBAT5urZGgosuR,{'saludprohibidaandreaskalcker': [3446]},no_data,Offizielles Kalcker-Institut – Offizielles Kalcker-Institut,de.kalckerinstitute.com,2023-01-14T15:20:49.808230,"Master-Seminar für Gesundheitspersonal, Therapeuten und Interessierte, die Bedenken über oxidative Therapien ausräumen wollen. Das Seminar wird sowohl live online als auch mit Videos durchgeführt. Es beinhaltet Prüfungen und wöchentlichen Live-Sitzungen mit Andreas Kalcker, an denen Sie aktiv teilnehmen können.",de
114,nlhwsIUBAT5urZGg8ctb,{'ejercitoremanente': [13555]},no_data,Los medios alternativos advirtieron de todo lo que está sucediendo hoy… ahora hemos descifrado lo que sucederá – Ejército Remanente🏹 Noticias,ejercitoremanente.com,2023-01-14T15:21:09.974724,,0
115,m1hwsIUBAT5urZGgzMuR,{'elinvestigador_org': [13175]},no_data,NEWS,twitter.com,2023-01-14T15:21:00.560259,"JavaScript is not available.

We’ve detected that JavaScript is disabled in this browser. Please enable JavaScript or switch to a supported browser to continue using twitter.com. You can see a list of supported browsers in our Help Center.

Help Center",en
116,n1hwsIUBAT5urZGg-cvW,{'ejercitoremanente': [13554]},no_data,Vacunas y posesión demoníaca – Ejército Remanente🏹 Noticias,ejercitoremanente.com,2023-01-14T15:21:12.149348,,0
117,k1hwsIUBAT5urZGgh8u6,{'saludprohibidaandreaskalcker': [3449]},no_data,The Portal Ep. 6 Dr. Andreas Kalcker- CDS & the Energetics of O2,odysee.com,2023-01-14T15:20:42.933173,,0
118,lVhwsIUBAT5urZGgl8sO,{'saludprohibidaandreaskalcker': [3447]},no_data,NEWS,saludprohibida.com,2023-01-14T15:20:46.859811,,0
