,id,channel,twitter,title,url,date,text,languague
0,oHx7K4UBjxRUNmXf1VDN,{'rafapalreal': [27955]},"{'1604650443942100994': {'favorites': 766, 'name': 'Sebastian Gorka DrG', 'profile_image': 'https://pbs.twimg.com/profile_images/1526273762756263936/odKb7Bff_normal.jpg', 'quoted_tweets': {}, 'retweet': 310, 'text': 'You thought you knew how many spooks work at Twitter? \n\nThink again.\n\n👇🏻 https://t.co/a2CTYbJ222'}, '1604658819090595840': {'favorites': 393, 'name': 'Breanna Morello', 'profile_image': 'https://pbs.twimg.com/profile_images/1570853234868101121/j_dy4nNp_normal.jpg', 'quoted_tweets': {}, 'retweet': 223, 'text': 'Facebook has dozens of former FBI  CIA, and NSA agents now working for them.\n\nAaron Berman claims to run Facebook’s… https://t.co/Wlc4q6AKVq'}, '1604667696553000962': {'favorites': 23, 'name': 'Thread Reader App', 'profile_image': 'https://pbs.twimg.com/profile_images/1358877011192647682/R31v0wbt_normal.png', 'quoted_tweets': {}, 'retweet': 24, 'text': '@CitizenFreePres @NameRedacted247 @CitizenFreePres Namaste, the unroll you asked for: https://t.co/yrxmPuFPPb Have a good day. 🤖'}, '1604671398999474180': {'favorites': 5, 'name': 'Thread Reader App', 'profile_image': 'https://pbs.twimg.com/profile_images/1358877011192647682/R31v0wbt_normal.png', 'quoted_tweets': {}, 'retweet': 5, 'text': '@justcheckinout4 @NameRedacted247 @justcheckinout4 Halo! the unroll you asked for: https://t.co/yrxmPuFPPb Share th… https://t.co/yHOo6JxdgW'}, '1604673631535173632': {'favorites': 97, 'name': 'Jeff Clark', 'profile_image': 'https://pbs.twimg.com/profile_images/1521516507519463425/14M9fcUm_normal.jpg', 'quoted_tweets': {}, 'retweet': 49, 'text': 'The revelations related to #twitterfiles just keep coming.\n\nNone should want to live in a USA like this.\n\nOne of th… https://t.co/AJg09YudV4'}, '1604673868827951104': {'favorites': 16, 'name': 'Thread Reader App', 'profile_image': 'https://pbs.twimg.com/profile_images/1358877011192647682/R31v0wbt_normal.png', 'quoted_tweets': {}, 'retweet': 11, 'text': ""@R_Sole1 @NameRedacted247 @R_Sole1 Bonjour, here is your unroll: https://t.co/yrxmPuFPPb Share this if you think it's interesting. 🤖""}, '1604676931986800641': {'favorites': 20, 'name': 'Matthew Loop', 'profile_image': 'https://pbs.twimg.com/profile_images/865739050845696002/v4aR4LUZ_normal.jpg', 'quoted_tweets': {}, 'retweet': 10, 'text': 'Facebook is the worst. A propaganda machine that censors anything against the mainstream narrative. They need to be… https://t.co/vTRbROrHU2'}, '1604744235508502531': {'favorites': 176, 'name': 'Bad Kitty Censored 🦁 🤐', 'profile_image': 'https://pbs.twimg.com/profile_images/1551583596132962304/5dQ2D_Pz_normal.jpg', 'quoted_tweets': {}, 'retweet': 63, 'text': 'When does it ever stop? Our social media is ran by the Intelligence Community. 🤦🏻\u200d♀️ https://t.co/rRNjPqcfTr'}, '1604853443922993152': {'favorites': 734, 'name': 'Diamond and Silk®', 'profile_image': 'https://pbs.twimg.com/profile_images/1257866413571813377/amVKEtcq_normal.jpg', 'quoted_tweets': {}, 'retweet': 207, 'text': 'This explains how FB, YT &amp; TW went from Sugar to straight SH!T.\n\nWe were probably 1st on their hit list because the… https://t.co/pwO1l0IPrJ'}, '1604858078263799808': {'favorites': 15, 'name': '𝐅𝐑𝐎𝐍𝐓𝐋𝐈𝐍𝐄⚡️𝐅𝐋𝐀𝐒𝐇', 'profile_image': 'https://pbs.twimg.com/profile_images/1559294302441857032/FK-CCEgH_normal.jpg', 'quoted_tweets': {}, 'retweet': 14, 'text': '⚠️CORRUPTION ALERT⚠️ https://t.co/S0V5UaNnfz'}}",NEWS,twitter.com,2022-12-19T19:43:34.092274,"JavaScript is not available.

We’ve detected that JavaScript is disabled in this browser. Please enable JavaScript or switch to a supported browser to continue using twitter.com. You can see a list of supported browsers in our Help Center.

Help Center",en
