,id,channel,twitter,title,url,date,text,languague
32,DVhyrYUBAT5urZGgMsuX,{'Medicosporlaverdad': [44488]},no_data,"David Kessler, top science officer for Biden's Covid response, to depart",www.politico.com,2023-01-14T01:23:40.468133,"Architect of the administration's mass vaccination campaign will exit amid preparations for end of the emergency response

David Kessler, who helmed the Biden administration’s efforts to develop and distribute coronavirus vaccines, treatments and tests, is stepping down.

Kessler has served as the Covid response’s top science official since the start of the administration, overseeing the purchase and initial rollout of hundreds of millions of vaccines. He later guided the booster shot campaigns and played a lead role in accelerating the development and availability of the Covid tests and treatments that became core elements of the White House’s plan to suppress the virus.

Advertisement

Kessler, 71, will officially leave the administration next week, ending more than two years of work on the pandemic response dating back to the Biden transition. Most recently, he shepherded the release in September of updated vaccines designed to better target newer strains of the virus.

“Whether he was leading our effort to develop and distribute safe and effective COVID-19 vaccines and treatments, or sharing his perspective during daily strategy sessions and data deliberations, Dr. Kessler’s contributions to our COVID-19 response have saved lives,” Health and Human Services Secretary Xavier Becerra said in a statement confirming his planned retirement from the post.

The government has now administered more than 665 million Covid shots, a historic campaign that sharply cut the risk of severe disease and death from the disease, and paved the way toward the resumption of everyday life for the majority of Americans.

Still, Kessler’s departure comes as the broader federal Covid response has narrowed its ambitions — and with the virus still accounting for more than 2,500 deaths a week. Congress declined to allocate additional funding for the response that is needed to develop more vaccines and treatments, ignoring months of warnings from Kessler and other top health officials.

Advertisement

States and localities have largely dropped their Covid precautions, and the rapid rise of a new Covid subvariant that appears better able to evade immunity has revived concern that the U.S. is mired in another winter surge.

The administration has also struggled to convince Americans to seek out the updated shot as pandemic fatigue sets in among the broader public. Fewer than 16 percent of those eligible have received the latest vaccine, according to the Centers for Disease Control and Prevention.

In recent months, Kessler had aided federal planning to shift coverage for vaccines and treatments to the private health insurance market later this year — a complex transition at the core of plans to eventually wind down the White House-led emergency response and transfer responsibility for much of the effort back to the health department. Kessler is the second senior Covid official to leave government of late, following top infectious disease expert and White House chief medical adviser Anthony Fauci’s departure at the end of last year.

An HHS spokesperson said a team of its doctors, scientists and public health officials would remain in close coordination with the White House and private sector on vaccine development following Kessler’s exit.

A former Food and Drug Administration commissioner who led the agency across two prior administrations, Kessler was part of the initial team that advised President Joe Biden’s transition on its Covid response preparations. Biden later named him chief science officer at HHS, putting him in charge of the federal vaccine accelerator originally known at Operation Warp Speed. Kessler worked closely with the White House in the early days of the presidency to organize and launch the nation’s mass Covid vaccination campaign.

Kessler was also central to Biden administration negotiations with drugmakers like Pfizer and Moderna over supply deals aimed at building out the nation’s stockpile of vaccines and treatments.

The Covid team accomplished its initial goals, securing enough shots for all Americans and eventually vaccinating more than three-quarters of American adults. Yet in August 2021, it became clear that vaccinated people could still get sick, dealing a blow to Biden and his ambitions of eliminating the virus altogether.

The rise of breakthrough infections reshaped the Covid response, and with it, Kessler’s job managing vaccine development and overseeing the nation’s supply of shots. The administration has since distributed multiple rounds of booster shots in a bid to stay ahead of the newest Covid strains, as well as a range of therapeutics.

Advertisement

Despite the difficulties in ensuring people keep up to date with their vaccines, studies show the risk of severe disease from Covid is substantially lower for those who have gotten all their shots — prompting White House officials to insist that nearly all deaths from the virus are preventable through the use of vaccines and treatments.

That more optimistic view, combined with the lack of congressional funding, has prompted Biden health officials to begin planning for the eventual wind-down of the administration’s emergency response later this year.",en
33,EFjwrYUBAT5urZGgVcv5,{'elarconte': [13505]},no_data,Le preguntan a una supuesta endemoniada sobre el sentido de las inoculaciones y la respuesta es clara y brutal,invierte.biz,2023-01-14T03:41:27.160070,"Please enable JavaScript play-sharp-fill Link Embed Copy and paste this HTML code into your webpage to embed.

Pues no sé cómo catalogar este vídeo, el caso es que supongamos que no es un montaje y que realmente no son actores los que aparecen en este vídeo, no puedo asegurarlo. Pero lo bueno son las respuestas de estos supuestos endemoniados porque las clavan totalmente, y si no mira compruébalo por ti mismo…

Me gusta esto: Me gusta Cargando...",es
34,EVjwrYUBAT5urZGgY8vX,{'canal5informa': [11057]},no_data,Infectados C-23,nurparatodos.com.ar,2023-01-14T03:41:30.709736,"SINOPSIS

El mundo ha estado viviendo encerrado durante cuatro años. A partir de ahora, las personas infectadas con el Covid-23 son enviadas a la fuerza a la cuarentena en campamentos que se han convertido gradualmente en preocupantes guetos. En Los Ángeles, Nico es un mensajero inmune al virus que deambula por la ciudad durante sus entregas. Así conoce a Sara, una joven confinada en su hogar. A pesar de los imperativos sanitarios que les impiden acercarse, Sara y Nico se enamoran. Pero cuando se sospecha que Sara está contaminada, se ve obligada a unirse a los campos de cuarentena. Nico luego intenta lo imposible para salvarla.",es
35,_1hxrYUBAT5urZGgvcpZ,{'saludprohibidaandreaskalcker': [3444]},no_data,Andreas Kalcker 💚 Trabajo de mantenimiento en foro Salud Prohibida 💚 Maintenance work at the Forbidden Health Forum,andreaskalcker.acblnk.com,2023-01-14T01:23:10.552109,"Si no puedes ver bien esta newsletter haz click aquí

Trabajo de mantenimiento en foro Salud Prohibida Estimado usuario del foro Salud Prohibida, Le informamos que estaremos realizando tareas de mantenimiento en la página www.saludprohibida.com para mejorar el foro. Por esta razón, no estará disponible algunos días. Por favor disculpe las molestias. Nos estamos esmerando en ofrecerle una mejor experiencia. Tan pronto esté listo el nuevo foro, recibirá otra comunicación para hacerle saber que ya está en funcionamiento de nuevo. Muchas gracias por su comprensión. Saludos cordiales del equipo de Salud Prohibida Maintenance work at the Forbidden Health Forum

Dear Forbidden Health forum user,



Please be informed that we will be performing maintenance tasks on the www.saludprohibida.com page to improve the forum.



For this reason, it will be unavailable for some days. Please excuse the inconvenience. We are doing our best to provide you with a better experience.



As soon as the new forum is ready, you will receive another communication to let you know that it is up and running again.



Thank you for your understanding.



Kind regards from the Forbidden Health team. Wartungsarbeiten am Verbotenen Gesundheitsforum Liebe ""Gesundheit verboten"" Forum-Benutzer(-innen),



wir möchten Sie darüber informieren, dass wir auf www.saludprohibida.com Wartungsarbeiten durchführen werden, um das Forum zu verbessern.



Aus diesem Grund wird die Seite für einige Tage nicht verfügbar sein. Bitte entschuldigen Sie die Unannehmlichkeiten.



Sobald die Seite überarbeitet ist, werden Sie umgehend per Email informiert.



Wir danken Ihnen für Ihr Verständnis.



Liebe Grüße vom Team ""Salud Prohibida"". Salvando vidas, entre todos. With ❤️ from Ave. Cubilete 2955, Guadalajara/Zapopan. Jalisco (México) Darme de baja | Modificar mis datos",en
36,nVharIUBAT5urZGgeMpq,{'ElDiestro': [32183]},no_data,La policía suiza controla incluso las huellas dactilares en Davos con motivo del Foro Económico Mund – El Diestro TV,eldiestro.tv,2023-01-13T20:18:08.322937,,0
37,GVjwrYUBAT5urZGgrMv9,{'laquintacolumna': [29259]},no_data,Braga para el vientre No Trace Graphene,mercacelta.com,2023-01-14T03:41:49.436987,,0
38,AVhxrYUBAT5urZGgzsvX,{'PLANDEMIA_MUNDIAL_COVID': [14924]},no_data,Zelensky gets one million dollars from US for each day of conflict,english-pravda-ru.translate.goog,2023-01-14T01:23:15.030418,"US pays Zelensky $1 million for each day of conflict in Ukraine

Former State Duma deputy, political scientist Sergei Markov said that Ukrainian President Volodymyr Zelensky sacrifices the lives of his fellow citizens for one million US dollars a day.

The United States pays Zelensky one million dollars for each day of the conflict in Ukraine, the political scientist said.

According to the expert, the Ukrainian leader is doing everything to please Washington, so the proposal made in US Congress to place Zelensky's bust in the White House did not sound like a joke at all.

""For the sake of the interests of the United States, Zelensky has taken the lives of 100,000 Ukrainian soldiers and left millions of Ukrainians homeless. Zelensky himself risks his life and is ready to fight for the interests of the United States to the last Ukrainian, albeit for money — for one million dollars a day,"" Markov wrote on his Telegram channel.

He suggested that US congressmen might have had in mind placing his bust posthumously.

Earlier, Fox News host Tucker Carlson criticised the initiative from Republican Joe Wilson, who proposed to install Zelensky's bust in the White House. Carlson called the idea insane because Zelensky was a dictator.",en
39,AFhxrYUBAT5urZGgyMuZ,{'PLANDEMIA_MUNDIAL_COVID': [14925]},no_data,Gran Bretaña: separaron a diputado por comparar las vacunas anticovid con el Holocausto,www.ambito.com,2023-01-14T01:23:13.432078,"Hart consideró que la opinión de Bridgen ""cruzó una línea"" de ofensa como no había sucedido con ninguna de sus frecuentes críticas a la vacunación.

""Debemos estar orgullosos de lo que se logró"" en la lucha contra el coronavirus, sostuvo Hart ante la agencia de noticias, Europa Press.

¿Qué dijo el Primer Ministro?

El primer ministro, Rishi Sunak, expresó su ""condena rotunda y en los términos más enérgicos"" a la declaración de Bridgen y señaló que ""es inaceptable establecer esos vínculos y usar un lenguaje como ese"".

Sunak remarcó que estaba ""decidido a erradicar el flagelo del antisemitismo"", que ""no tiene absolutamente ningún lugar"" en la sociedad británica.

""Sé que los años anteriores fueron un desafío para la comunidad judía y no quiero que vuelva a pasar por algo así"", concluyó.",es
40,CVhyrYUBAT5urZGgHcu2,{'despertadordelamatrix': [28383]},no_data,Eimer Hut Strahlung 5G 4G Signal Block EMF Schutz Silber Faser Futter Mode Kappe,s.click.aliexpress.com,2023-01-14T01:23:35.221106,By continuing to use AliExpress you accept our use of cookies (view more on our Privacy Policy). You can adjust your Cookie Preferences at the bottom of this page.,en
41,CFhyrYUBAT5urZGgC8v4,{'despertadordelamatrix': [28394]},no_data,Hotmart,go.hotmart.com,2023-01-14T01:23:30.679318,"¿Estás comprando como empresa o autónomo y tienes un NIF-IVA intracomunitario?

Añadir NIF-IVA Intracomunitario",es
42,FFjwrYUBAT5urZGghMs8,{'tierrapura': [15445]},no_data,La Cámara de Representantes de EE. UU. aprueba salvar a sobrevivientes de abortos,tierrapura.org,2023-01-14T03:41:39.003253,"Mamela Fiallo Flor – Panam Post

Hasta ahora el personal médico en Estados Unidos no está obligado a brindar atención a los recién nacidos si son producto de un aborto fallido. Es decir, el aborto no se limita a poner fin a la vida del feto o embrión en el vientre de su madre. Incluso si llega a nacer no podría sobrevivir. Este fue un tema que en varias legislaciones intentó aprobar –sin éxito– el Partido Republicano debido a la resistencia que encontraba en los demócratas que dominaban el Congreso. Ahora, con la Cámara de Representantes con mayoría republicana, los conservadores lograron recién iniciado el nuevo periodo aprobar un proyecto que permite salvar a los sobrevivientes de abortos.

La formación política del presidente Joe Biden mantuvo en esta oportunidad su posición, pero no le alcanzaron los votos para volver a frenar la iniciativa. Un total de 210 legisladores del Partido Demócrata votaron en contra de salvar la vida de los sobrevivientes de abortos fallidos. Apenas uno se unió a los republicanos. Se trata del congresista hispano por Texas, Henry Cuellar. Otro hispano de Texas, Vicente González, prefirió abstenerse.

210 Diputados estadounidenses del Partido Demócrata acaban de votar en contra de brindarle atención médica a los bebes que sobrevivan un intento de aborto. El proyecto se aprobó por 218 Diputados del Partido Republicano, que tiene mayoría. Cómo vas a votar que NO a esto? — Agustín Romo ⭐️⭐️⭐️ (@agustinromm) January 11, 2023

Para que finalmente esta ley pueda ser sancionada debe ser aprobada en el Senado, donde los demócratas tienen el control de 51 escaños frente a 49 republicanos. Las probabilidades son escasas. No obstante, Henry Cuellar expone la posibilidad de que su caso pueda replicarse en la Cámara alta, aunque los republicanos necesitan sumar dos votos para alcanzar la mayoría.

En todo caso, los conservadores han cumplido con lo prometido en su agenda en tiempo récord y han puesta ahora la pelota en el otro bando, dándole la oportunidad a los demócratas de sumarse a esta iniciativa o quedar ante el país como defensores del asesinato de recién nacidos que tuvieron la mala suerte de que su madre haya intentado abortarlos.

Una mujer emprendió la lucha a favor de los recién nacidos

Desafiando el relato feminista, la autora de La Ley de Protección de Sobrevivientes de Abortos Nacidos Vivos fue la representante Ann Wagner, quien consiguió que el proyecto pasara el filtro en la Cámara baja con 220 votos frente a 210 en contra.

«La legislación de la congresista Wagner brindaría a los bebés nacidos vivos durante un aborto la atención médica necesaria y vital que cualquier otro bebé recibiría para darles la mejor oportunidad de vida», explicó el líder de la mayoría en la Cámara de Representantes, Steve Scalise. «Los republicanos estamos comprometidos con defender la vida y hacer todo lo que esté a nuestro alcance para mantener vivos a los bebés que sobreviven a un aborto».

La ley requeriría que los profesionales de la salud proporcionen tratamiento médico y medidas para salvar la vida de los bebés nacidos vivos después de un aborto fallido. Esto sucede sobre todo en los abortos tardíos, luego del sexto mes de gestación (aunque también en el quinto). Pues ya tienen el desarrollo suficiente para poder nacer vivos y sobrevivir. Pero, sobre todo en los estados de mayoría demócrata, es posible poner fin a sus vidas. Ahora los proveedores de salud que no cumplan con la ley podrían estar sujetos a responsabilidad civil y acusación penal si finalmente es sancionada y entra en vigor.

Según el proyecto aprobado en la Cámara baja, si un feto logra sobrevivir a un aborto, se considerará una persona jurídica y tendrá derecho a las protecciones de las leyes estadounidenses como cualquier otro recién nacido.

Condena a la violencia contra iglesias y centros provida

La mayoría republicana también logró aprobar en la Cámara de Representantes otro proyecto de ley que va en la misma dirección. Se trata de una resolución que condena la violencia contra instalaciones, grupos e iglesias que se oponen al aborto. La iniciativa fue aprobada con 222 votos a favor frente a 209 en contra. Tres demócratas se unieron en este caso a los republicanos: los representantes Vicente González de Texas, Chrissy Houlahan de Pensilvania y Marie Pérez de Washington.

Por primera vez en la historia, la Suprema Corte de EE. UU. tiene mayoría católica, también conservadora. Esto volvió a la Iglesia foco de ataques. Como consecuencia de la revocación del fallo Roe vs. Wade, hubo desde estatuas decapitadas hasta iglesias incendiadas y vandalizadas. También los centros de apoyo para mujeres con embarazos vulnerables fueron atacados. Es por esta razón que los legisladores conservadores buscan proteger a estas instituciones.

En contraste, el voto casi unánime de los demócratas expone dos cosas. Primero, cómo el progresismo no se trata de progreso sino de pasos progresivos hacia el totalitarismo, dándole al Estado el poder de decidir quién nace y quien no, incluso de descartar a quienes han logrado nacer vivos pero el plan era abortarlos. Y segundo, muestra cómo, cuando el aborto se considera un derecho, se vuelve irrevocable para sus defensores, al punto que deshumanizan incluso a los sobrevivientes.

A su vez, el no condenar el ataque contra instituciones privadas (e incluso sagradas) expone su expansión ideológica. Sin embargo, hay entre sus filas algunos referentes hispanos que representan a sus distritos con valores tradicionales y se resisten a la tendencia que impone el partido.",es
43,pFhbrIUBAT5urZGgE8pu,{'tierrapura': [15443]},no_data,El Pentágono rescinde el mandato de la vacuna COVID-19 para las tropas,tierrapura.org,2023-01-13T20:18:48.044861,,0
44,pVhbrIUBAT5urZGgHspC,{'laquintacolumna': [29242]},no_data,Facebook,m.facebook.com,2023-01-13T20:18:50.817227,"Wenn du ein Facebook-Konto hast, kannst du mithilfe dieser Tools festlegen, wie unterschiedliche Daten zur Personalisierung von Werbeanzeigen verwendet werden.

Einstellungen für Werbung

Um dir bessere Werbung zu zeigen, verwenden wir Informationen, die Werbetreibende und andere Partner uns zu deinen Aktivitäten außerhalb von Produkten der Meta-Unternehmen, zum Beispiel auf deren Websites und Apps, bereitstellen. In deinen Einstellungen für Werbung kannst du festlegen, ob wir diese Informationen verwenden dürfen, um dir Werbung zu zeigen.

Über das Meta Audience Network können Werbetreibende dir Werbeanzeigen in Apps und auf Websites außerhalb der Produkte der Meta-Unternehmen zeigen. Um relevante Werbeanzeigen auszuliefern, bestimmt das Audience Network zum Beispiel anhand deiner Werbepräferenzen, an welchen Werbeanzeigen du interessiert sein könntest. Dies kannst du in deinen Einstellungen für Werbung verwalten.

Werbepräferenzen

In deinen Werbepräferenzen kannst du nachsehen, warum du eine bestimmte Werbeanzeige siehst, und festlegen, wie wir die Informationen, die wir erfassen, verwenden dürfen, um dir Werbung zu zeigen.

Aktivitäten außerhalb von Facebook",de
45,nlharIUBAT5urZGgkspr,{'elarconte': [13496]},no_data,"¿Quieres limpiar tus arterias y que tu cuerpo funcione muchísimo mejor? Este simple consejo te ayudará y el remedio no te costará ni un euro, sanidad información en Invierte.biz",invierte.biz,2023-01-13T20:18:15.013242,"Usamos cookies para asegurar que te damos la mejor experiencia en nuestra web. Si continúas usando este sitio, asumiremos que estás de acuerdo con ello.",es
46,oFharIUBAT5urZGg8Mp5,{'elarconte': [13492]},no_data,"A una reportera de la OTAN le chafan la crónica en directo: «Los que nos están disparando son ucranianos no rusos», información internacional en Invierte.biz",invierte.biz,2023-01-13T20:18:39.096289,"Usamos cookies para asegurar que te damos la mejor experiencia en nuestra web. Si continúas usando este sitio, asumiremos que estás de acuerdo con ello.",es
47,JljxrYUBAT5urZGgGMvn,{'trikooba': [6780]},no_data,El primer barco de investigación científica no tripulado del mundo entra en servicio en China,trikooba.org,2023-01-14T03:42:17.062829,"Luego de completar las últimas pruebas en altamar, la embarcación Zhu Hai Yun, el primer buque de investigación científica inteligente no tripulado del mundo, entró en servicio, informan fuentes oficiales.

De acuerdo con el comunicado, el barco cuenta con un sistema de navegación autónoma en aguas abiertas, así como funciones de control remoto. Del mismo modo, «puede proporcionar información de inteligencia y recolectar datos para resolver un gran número de problemas de aplicación práctica».

El Zhu Hai Yun, de 88,5 metros de eslora, 14 metros de manga y calado de 3,7 metros, tiene un desplazamiento de diseño de unas 2.000 toneladas y es capaz de alcanzar una velocidad máxima de 18 nudos.

Haz clic en la imagen para comprar tu taza

Por otra parte, puede equiparse con una amplia variedad de instrumentos no tripulados para realizar diversas tareas de investigación, observación, inspección y muestreo, tanto topográfico como cartográfico.

🤝Recuerda que puedes apoyar la labor informativa de Trikooba de una manera rápida, sencilla y totalmente gratuita para ti.

Haz clic aquí para saber cómo.

Se prevé que en 2023 el Zhu Hai Yun realice trabajos de observación y cartografía marina, así como patrullajes y labores de reconocimiento marino integral.",es
48,4FjkrIUBAT5urZGgFsrM,{'tierrapura': [15444]},no_data,"Lavr Kornílov, el general ‘blanco’ que fundó la resistencia anticomunista de Rusia",tierrapura.org,2023-01-13T22:48:27.339392,,0
49,1VjjrIUBAT5urZGgC8o4,{'ElDiestro': [32190]},no_data,¡¡Demoledor!! Parlamento Europeo – El Diestro TV,eldiestro.tv,2023-01-13T22:47:18.834302,,0
50,5VjkrIUBAT5urZGgOsr9,{'estamosdespiertos': [17419]},no_data,LOS SECRETOS DE LAS VACUNAS 💉🕵🏻 – PARTE 1 – Lourdes Relloso,lourdesrelloso.tv,2023-01-13T22:48:36.603776,,0
51,m1harIUBAT5urZGgZ8rH,"{'ElDiestro': [32185], 'estamosdespiertos': [17418]}",no_data,Esto es lo que hacen los ciudadanos de Oxford con su ciudad de 15 minutos – El Diestro TV,eldiestro.tv,2023-01-13T20:18:04.102296,,0
52,2ljjrIUBAT5urZGgdcpy,{'elarconte': [13499]},no_data,"El doctor Luis de Benito habla sobre las muertes repentinas, salud noticias de Invierte.biz",invierte.biz,2023-01-13T22:47:46.033687,"Usamos cookies para asegurar que te damos la mejor experiencia en nuestra web. Si continúas usando este sitio, asumiremos que estás de acuerdo con ello.",es
53,11jjrIUBAT5urZGgHsqT,{'ElDiestro': [32188]},no_data,Vi0ló a una n1ña de 4 años y recibió en el juzgado un adelanto de lo que le pasará en prisión – El Diestro TV,eldiestro.tv,2023-01-13T22:47:23.745954,,0
54,1ljjrIUBAT5urZGgE8qD,{'ElDiestro': [32189]},no_data,Ejemplo de la bazofia periodística que hay en España – El Diestro TV,eldiestro.tv,2023-01-13T22:47:20.958566,,0
55,5ljkrIUBAT5urZGgRsqx,{'estamosdespiertos': [17417]},no_data,INVESTIGADOR INTERNACIONAL SACANDO LOS OSCUROS SECRETOS DE LAS ÉLITES Y LA BESTIA ( Raúl Durán),youtu.be,2023-01-13T22:48:39.600995,,0
56,H1jwrYUBAT5urZGg4cvi,{'laquintacolumna': [29249]},no_data,¿COVID o irradiación electromagnética?,odysee.com,2023-01-14T03:42:02.973228,,0
57,IFjwrYUBAT5urZGg5MvH,{'laquintacolumna': [29248]},no_data,Twitch,www.twitch.tv,2023-01-14T03:42:03.716521,,0
58,IljwrYUBAT5urZGg9MsE,{'laquintacolumna': [29246]},no_data,"Airlines Move To Have One Pilot, Not Two, In Cost-Cutting Solution",www.forbes.com,2023-01-14T03:42:07.619404,,0
59,C1hyrYUBAT5urZGgJ8uM,"{'Medicosporlaverdad': [44489, 44486]}",no_data,Telegram for Android,telegram.org,2023-01-14T01:23:37.740142,This video shows how to install Telegram on yourdevice. See this page for detailed steps on various versions of Android.,en
60,ClhyrYUBAT5urZGgJMvv,"{'Medicosporlaverdad': [44489], 'rafapalreal': [28564]}",no_data,NEWS,twitter.com,2023-01-14T01:23:37.071004,"JavaScript is not available.

We’ve detected that JavaScript is disabled in this browser. Please enable JavaScript or switch to a supported browser to continue using twitter.com. You can see a list of supported browsers in our Help Center.

Help Center",en
61,E1jwrYUBAT5urZGgecsH,{'tierrapura': [15446]},no_data,Atesorando la incomodidad: la comodidad mata el crecimiento y la productividad,tierrapura.org,2023-01-14T03:41:36.041978,,0
62,FVjwrYUBAT5urZGgjMvs,{'laquintacolumna': [29265]},no_data,DIRECTO NOCTURNO DE LA QUINTA COLUMNA,odysee.com,2023-01-14T03:41:41.227298,,0
63,F1jwrYUBAT5urZGgnsuV,{'laquintacolumna': [29263]},no_data,Una hoja de ruta para el grafeno,www.youtube.com,2023-01-14T03:41:45.722794,,0
64,FljwrYUBAT5urZGglctH,{'laquintacolumna': [29264]},no_data,Fantasía nunca desaparecerá,www.youtube.com,2023-01-14T03:41:43.361374,,0
65,GFjwrYUBAT5urZGgpctm,{'laquintacolumna': [29261]},no_data,NEWS,www.researchgate.net,2023-01-14T03:41:47.492336,,0
66,GljwrYUBAT5urZGgsssg,{'laquintacolumna': [29258]},no_data,NEWS,www.sciencedirect.com,2023-01-14T03:41:50.751278,,0
